<?xml version="1.0" encoding="UTF-8"?>
<discussioni xmlns:xsi="http://www.w3.org/2001/XMLSchema-instance" xsi:noNamespaceSchemaLocation="domande.xsd"><domanda stato="aperta"><idDom>4</idDom><dataCreaz>2019-07-01</dataCreaz><creatore>cliente1</creatore><testo>ciaociao</testo></domanda><domanda stato="chiusa"><idDom>1</idDom><dataCreaz>2019-07-01</dataCreaz><creatore>cliente1</creatore><testo>fffffffffffffffff</testo></domanda><domanda stato="aperta"><idDom>2</idDom><dataCreaz>2019-07-01</dataCreaz><creatore>cliente1</creatore><testo>asdasdasdas</testo><risposta><idRisp>4</idRisp><dataCreaz>2019-07-01</dataCreaz><creatore>gestore1</creatore><testo>ciao</testo></risposta><votoDomanda><creatore>cliente3</creatore><valoreVoto>true</valoreVoto></votoDomanda></domanda><domanda stato="aperta"><idDom>3</idDom><dataCreaz>1999-02-01</dataCreaz><creatore>cliente2</creatore><testo>Quanto fa pena Gianluca?</testo><risposta><idRisp>1</idRisp><dataCreaz>2019-06-29</dataCreaz><creatore>cliente1</creatore><testo>prova</testo></risposta><risposta><idRisp>2</idRisp><dataCreaz>2019-06-29</dataCreaz><creatore>cliente1</creatore><testo>prova1</testo></risposta><risposta><idRisp>3</idRisp><dataCreaz>2019-06-30</dataCreaz><creatore>cliente1</creatore><testo>prova prova</testo></risposta><votoDomanda><creatore>cliente1</creatore><valoreVoto>true</valoreVoto></votoDomanda></domanda></discussioni>
